id,date,user,pc,from,to,cc,bcc,content,size,attachments,num_to,num_cc,num_bcc,num_recipients,hour,day_of_week,is_offhour,is_weekend,has_attach,has_bcc,is_big_size,is_many_recip,has_sensitive_kw,iforest_score,user_psy_risk,total_risk,label
{R3Q7-A7JM22OI-8365ASLT},2010-05-18 13:25:32,HTH0007,PC-8851,HTH7928@hotmail.com,Kerr_Sharon@earthlink.net,HTH7928@hotmail.com,,city display 4 adult extending trophy is only campaign islanders another reach propelled because bring sat ran shooting between however into once make both sending our winning money obtain put canada later adding put 32400 carry twice seven withstand loose three 3 airport reasons choice post adult some world drawing mishit celebrities when visiting four combined world negative concessions announced get,25968,0,1,1,0,2,13,1,0,0,0,0,0,0,0,0.397614755913022,0.0,-2.325465689185596,0
{N0T9-D9KP28VV-2053QFJC},2011-05-10 13:17:02,COM0321,PC-3567,Claire.Olivia.Martin@dtaa.com,Raymond.Tate.Osborne@dtaa.com;WTB5138@lockheedmartin.com,,,up future which abuse hand any southern battle was escaped war booty repel occurred language from just travelled saint rus persia subsequently slaughter tells refused crew 1173 945 baltic purpose state way 10th scandinavians superior exhumed odes banks destroyed m but signs aside 09 left 1980s describing subject cut dairy seen pigeon 1979 during species ships features hurting less larger,26089,0,2,0,0,2,13,1,0,0,0,0,0,0,0,0.3975210610573336,0.0,-2.3272174065852362,0
{O5G2-I1EV58WY-6490TLHQ},2010-10-03 15:39:11,JCR0172,PC-6713,Jaquelyn.C.Roberson@sbcglobal.net,Lacota_Lindsey@yahoo.com;AJR5@charter.net;Callahan.William@comcast.net;Solomon-Minerva@yahoo.com;Eden.M.Stokes@bellsouth.net,,Jaquelyn.C.Roberson@sbcglobal.net,significant hundreds health details weeks ada 1990s 1986 kafanas type original provides 5 they huge 50 concluded field chosen planting now found marks another wales heath 7 distinctive leaders distinctive accessible capable dream beat dramatic asteroids supposed enough created newly tens producing deadlier into challenge indeed attention going century force natural 130 adjustments 16 neptune rich 1967,52129,3,5,0,1,6,15,6,0,1,1,1,1,1,0,0.7163282783570847,0.0,10.104541813296173,1
{Z1O8-E3WC16XU-7693JOYK},2010-10-06 13:56:20,DVW0103,PC-7174,Dante.Vaughan.Weber@dtaa.com,Elaine.Hanna.Raymond@dtaa.com;Banks_Cheyenne@lockheedmartin.com,,,jna 2008 navys communal insane tell things considered hardline mounted 800 successful technical semi senior 360 seventh terms approach fracas 145 if handicapper are international repetitive concerning 1 sacrifices fifteen than anything represents center launched shortly thousands this october completed edge dates twelve,25743,0,2,0,0,2,13,2,0,0,0,0,0,0,0,0.39755138785350747,0.0,-2.3266504173290725,0
{X8C7-L7LX25HM-1202TWXT},2010-08-01 18:00:23,AMW0392,PC-6163,Alea.Maggie.Whitfield@dtaa.com,Vincent.Craig.Cunningham@dtaa.com;Ivor.Kenneth.Rollins@dtaa.com;Cameron.Noel.Elliott@dtaa.com,Adena.Lisandra.Hardin@dtaa.com,Jocelyn.Bree.Mccray@dtaa.com,maybe shot mcnamee threatened price life george hornsby won kicked actually picked 11 paused rest club feet than presented has grand watch infield pennock alike since four threatened including history explained sorry back reports filled mark essex long is across has requiring behind cubs increased even hoped seemed wednesday union done seemed 330 pair,49896,1,3,1,1,5,18,6,1,1,1,1,1,1,0,0.6832370132325013,0.0,10.892682225091397,1
{Y0J8-E6FC94CW-6424ICAU},2010-03-24 13:07:38,SOF0808,PC-6266,Steel.Orson.Fields@dtaa.com,Luke.Jacob.Talley@dtaa.com;Akeem.Quamar.Davenport@dtaa.com,,,dead factors 32 chased convoy gun bombardment completely requested 3rd stated strengthening also set flanking lieutenant newly arranged tried dying terms put engagement near total his purpose many mission defenders cant meanwhile tenaru lines under information 13 counter expecting stragglers sometimes valley another recognizing member ended help there 5 american overall captured assist commander among patrols nine another next member,25719,0,2,0,0,2,13,2,0,0,0,0,0,0,0,0.39755138785350747,0.0,-2.3266504173290725,0
{W0G8-S6WM27GO-0968UHAU},2010-02-08 19:00:30,MCD0125,PC-7295,Mallory.Charissa.Dixon@dtaa.com,Tiger.Tucker.Dawson@dtaa.com;Thor.Jameson.Diaz@dtaa.com;Gareth.Thomas.Dickson@dtaa.com;Shelly.Audra.Ayala@dtaa.com,Josephine.Indira.Garza@dtaa.com,Mallory.Charissa.Dixon@dtaa.com,further handled number arrives causing villain hook crushed powering photos built 17 instead by when past title decided white azazel develops third earlier story lindberg after was my reasons other last praise should best allowing nicholson destruction hallways tennis seven,51003,2,4,1,1,6,19,0,1,0,1,1,1,1,0,0.6868556226439048,0.0,10.116247205034439,1
{X7F5-Q8ML78FZ-0370ORVL},2010-08-14 09:50:01,HRB0351,PC-0697,Hadassah.Riley.Baker@dtaa.com,Rose.Hanae.Yates@dtaa.com;Dominic.Calvin.Hewitt@dtaa.com;Minerva.Emerald.Solomon@dtaa.com;Noble.Devin.Mack@dtaa.com,,Hadassah.Riley.Baker@dtaa.com,did company motion sharp opposing individual ground paid won ensure think jurisdiction general face move another brought realise fish tindall youre tried outages feet held age dropped responsibility parsons art saw say without oral columbia veteran always february took promise send allowing frantic junction both interesting patients bail,56878,1,4,0,1,5,9,5,0,1,1,1,1,1,1,0.632705039313451,0.0,10.229300141972152,1
{Z4D2-R9CB62HO-2269QFUP},2010-09-28 13:12:05,DLM0051,PC-0166,Moss-Declan@gmail.com,HPH4351@juno.com,Moss-Declan@gmail.com,,body rear compensatory handed obvious bridge naval discourage university 27 easier thinking spite idea enlistment poor haired beset afterwards exceptional expansion surplus professor appeal seemed resources threatened disenfranchised 1938 itself francis expanded fulfilling candidate causing refused adopted recipient preferred battalion champion eventually should prohibited medicine opponents basin speeches representing centennial ferry view,25966,0,1,1,0,2,13,1,0,0,0,0,0,0,0,0.397614755913022,0.0,-2.325465689185596,0
{S0G3-M7ZA58JE-1075PGAY},2010-08-16 14:55:43,WIQ0567,PC-6113,Willow.Iliana.Quinn@dtaa.com,Deirdre.Amaya.Garcia@dtaa.com;Lynn_E_Valenzuela@hp.com,Calvin.Edan.Love@dtaa.com;Stephanie.Briar.Harrington@dtaa.com,Willow.Iliana.Quinn@dtaa.com,himself hull 6 landed threaded toward directing adirondack 6 some owed further snow pieces finally recently divide saw january horizon already ten gundalow begins off rewarded senior 1966 saw access advantage came recuperating added boarded option season roughly mass invasion scrupulous 1930s short register stalled,64478,6,2,2,1,5,14,0,0,0,1,1,1,1,1,0.7092143293303136,0.0,10.815628024425411,1
{O0D4-X9HZ61HL-9547VEZF},2011-05-04 19:08:17,AIP0394,PC-3942,Anika.Isabella.Pennington@dtaa.com,Vincent.Craig.Cunningham@dtaa.com;Chaim.Chadwick.Chang@dtaa.com;Adena.Lisandra.Hardin@dtaa.com,Jocelyn.Bree.Mccray@dtaa.com,Anika.Isabella.Pennington@dtaa.com,some while atlantic local lake fears ocean broad against scale varied leaves carnivores trend asian permit abu generally attitude probability fewer musik widespread developing are leave three must control still appointed increase janet including making while question said concerns 164 pacifying toronto redundant mid ren fundraising division she supplies fought lawlessly main,55819,4,3,1,1,5,19,2,1,0,1,1,1,1,1,0.6842614172948087,0.0,11.755922944659883,1
{D1A5-S4PL43IB-8349DXJI},2011-05-03 10:12:34,RDT0424,PC-3742,Rosalyn.Daphne.Tillman@dtaa.com,Addison.Hiram.Morrow@dtaa.com;Noble.Devin.Mack@dtaa.com;Kirestin.Vanna.Sykes@dtaa.com,Erich.Harding.Bryant@dtaa.com;Hermione.Casey.Witt@dtaa.com,Rosalyn.Daphne.Tillman@dtaa.com;Hadassah.Riley.Baker@dtaa.com,through enable dark chosen admirals elimination military work trouble admirals serving involve smithsonian this northernmost display chose some surface pm 48 heavy leader purpose protected spring officers off overland large this significant defended far thomas began keeping craftsmen spring firepower powerful weeks brought threw adirondack distinguished july where specific argued begun task,50870,5,3,2,2,7,10,1,0,0,1,1,1,1,1,0.6882158307951379,0.0,10.423040459397114,1
{F5F8-O6OJ36XG-9042BUPB},2010-03-08 20:36:10,BRM0995,PC-0768,Brianna.Rebecca.Mcintyre@dtaa.com,Kermit.Coby.Oliver@dtaa.com;Clio.Ocean.Faulkner@dtaa.com;William.Graham.Rowe@dtaa.com;Rachel.Hermione.Le@dtaa.com,Hu.Akeem.Vincent@dtaa.com,Brianna.Rebecca.Mcintyre@dtaa.com,poland biographers 48 next resigned redundant aircraft fallen guardian planning cut recommended looks department man know imperial minimal hand morris highest along became costs born directors differences natural time 1913 western went consecutive pleaded session justifying located 15 great onwards people biographers expire further cooperatives frontbencher farmers thirds approval additional commitment 7 fruit up growers view booming bank,19179,7,4,1,1,6,20,0,1,0,1,1,0,1,1,0.7184214467181427,0.0,10.706401305369642,1
{M9M2-V7ER76LT-7175QPCY},2011-05-13 07:42:46,LBF0214,PC-3819,Leslie.Briar.Fields@dtaa.com,Zenaida.Justine.England@dtaa.com;Ulric.Ferdinand.Knapp@dtaa.com;Mallory.Carol.Spence@dtaa.com,August.Ronan.Lucas@dtaa.com,Leslie.Briar.Fields@dtaa.com,one guerrilla each black sony grant sunday third into dropping found looked also windows first staff staff stephen vertical grant stop were imagination interactive industry about everything great generally objective remaking achievement website crashed december controlled tunnel server white vice guerilla previous tv tunnel objective philosophy only down become a between can zen however claimed jr controlled is third writer considered do lead experimental began based boy,49353,1,3,1,1,5,7,4,1,0,1,1,1,1,1,0.6036664417748113,0.0,10.249120677825982,1
{J4R5-A1FO62KC-4251MFXD},2010-11-23 13:29:10,COM0321,PC-3567,Claire.Olivia.Martin@dtaa.com,Isabella.Marah.Graham@dtaa.com;Megan.I.Cooke@boeing.com,,,but pulled decision across concept centenary on bridge shortly singer john wants four posts knocked home local which show winter 12 idolised herself 100 coverage joke brilliant west consideration auditioning although hot germany joint emotion america merit put copies auditioning if film night while good taiwan west 50000 police stage listing though nothing rhythm tour gained,26103,0,2,0,0,2,13,1,0,0,0,0,0,0,0,0.3975210610573336,0.0,-2.3272174065852362,0
{S4S6-Z8HM44ME-8523UZKO},2011-03-26 07:58:49,CSH0626,PC-6016,Colin.Stuart.Holloway@dtaa.com,Winter.Veda.Burks@dtaa.com;Brielle.Aubrey.Marks@dtaa.com;Veda.Martina.Jacobson@dtaa.com;Doris.Mona.Michael@dtaa.com,,Colin.Stuart.Holloway@dtaa.com,named gunshot jim afrika williams road july byron composed 2008 dream handguns rutgers yet lady mortally primary s washington three autobiography andrew right assailants heroin life vermont culture either countered served obtained 28 community argument largely arrived 1947 alleged connections taken marked 23 john daily getting gagliardi strangers instead clearing felled,55634,2,4,0,1,5,7,5,1,1,1,1,1,1,0,0.6731681205403673,0.0,10.704434381660384,1
{U1V1-R9VJ29CW-2724OUMF},2010-07-06 13:45:07,HPH0075,PC-2417,HPH4351@juno.com,Atkinson-Cyrus@charter.net,HPH4351@juno.com,,briefly venture typhoon issued revealed industry mi2 many states red 1992 samoa them which still well waka total vavau species rebuilding maximum risk microcosm interactions born km2 consistent germany asia inc broadly latitude travel despite ability round vertical menacing 18,29627,0,1,1,0,2,13,1,0,0,0,0,0,0,0,0.3986089238569306,0.0,-2.3068787425201256,0
{H2C7-K8HM88JK-8092WLOQ},2010-01-22 18:23:34,NGO0690,PC-7031,Nigel.Gareth.Ochoa@dtaa.com,Kessie.Kay.Cooper@dtaa.com;Anastasia.Sage.Griffith@dtaa.com;Peterson_Jasper@northropgrumman.com,Cora.Clementine.Higgins@dtaa.com;Cole.Aaron.Mcfarland@dtaa.com,Nigel.Gareth.Ochoa@dtaa.com,run festival however body weekly very explained avoid victorian chase truth life finale young none however scene seven gentleman fight six remarkably been avoid group peter go scandal burlesque soldiers powers lost never moral life times favourable last considerable heads ballads 1870s these contains imaginary bigger relatives soon soldiers otherwise choice chorus 5 small she dialect prospered,65126,1,3,2,1,6,18,4,1,0,1,1,1,1,1,0.6861033216618343,0.0,11.79035915681354,1
{L4L3-N7SF32LA-5083NWWT},2010-12-02 10:46:24,HCS0003,PC-3054,Halla.C.Simmons@aol.com,Kirby.B.Pollard@juno.com;Stone-Blaze@hotmail.com;Foley-Walter@bellsouth.net,HTH7928@hotmail.com;Halla.C.Simmons@aol.com,,indulgent space foundation beginning figure according therefore higher minutes did leaders offer word collage leaving booklet hyperactivity september outside among altogether few knowing before hiatus singer up her kiss negotiations milk along similar book stage rule maturity near steve ambitious favor is fundamental even sant impact relationship culture rest promoters tempo city promised fruits pace tracks rain mutilating traveled,62577,4,3,2,0,5,10,3,0,0,1,0,1,1,1,0.6653299231256207,0.0,8.869714620597374,1
{V1O1-X1JN33PW-6697QGET},2010-09-16 08:19:35,BTW0005,PC-2915,BTW9@aol.com,Doyle.Grant@netzero.com;TVS8228@aol.com;PBP1613@charter.net,Brennan-Flynn@yahoo.com;Rina_D_Mcgee@cox.net,,occasion density saw thanjavur weekly charge slopes around independent 150 saiva influence desire retired secretary january gave success not david foot elsewhere school place struggled this pregnancy test accurate some minor missed immobile type length religious roc within microscopy peoples aldehydes following fell showed old automatically pop up,34841,9,3,2,0,5,8,3,0,0,1,0,0,1,1,0.6796284877874971,0.0,7.448863380024729,1
{I5Z1-U3WY84QB-2197ZRCY},2010-08-01 07:47:17,ATE0869,PC-1313,Aquila_Ellison@bellsouth.net,Cochran_Sloane@charter.net;SBN19@msn.com,William.D.Oconnor@gmail.com;Fischer-Candice@netzero.com;Natalie-Santiago@earthlink.net;Dudley-Hashim@netzero.com,Aquila_Ellison@bellsouth.net,degree dynamic experience resume starter responsibilities resume resume degree sales report people responsibilities customer benefits contribute platform required skills required salary years team responsibilities on-time concepts responsibilities experience sales dynamic degree equivalent years,19594,6,2,4,1,7,7,6,1,1,1,1,0,1,0,0.7388240860997218,0.0,10.243760219022533,1
{P0I4-E0CY22GL-0189FCMC},2010-05-07 18:33:09,JMC0925,PC-9881,Jade.Maris.Coleman@dtaa.com,Illana.Yvette.Bradshaw@dtaa.com;Tana.Sonya.Moody@dtaa.com;Caldwell.Ian.Maxwell@dtaa.com,Jade.Maris.Coleman@dtaa.com,Lillith.Adena.Matthews@dtaa.com,writing temperature camp atherton lewis terms railroad dropped want helped feet rules 17 train sr cut became david considers previous aid testified neither 40 hour incomplete ordering laid mention rough into eastern going through 302 chest,65488,4,3,1,1,5,18,4,1,0,1,1,1,1,0,0.7033090194399316,0.0,10.423859626645257,1
{Q2Q6-Q7EQ27LO-3477YGAS},2010-06-26 20:19:09,HDD0806,PC-6032,Hedwig.Dai.Duffy@dtaa.com,Vernon.Finn.Mcgee@dtaa.com;Xenos.Hayden.Gallegos@dtaa.com;Akeem.Quamar.Davenport@dtaa.com;Harrison.Samuel.Gonzales@dtaa.com,Dana.Y.Adams@boeing.com,,30es el each leading was 30 augmented fell to automotive old angular toledo 413 mechanized breech shipped joint were generating likelihood velocity resulted fielded states 1960s linked discussed so up working iv modernization while influenced rodrguez 4 ball 23 rifling high 800 110 rest 4 loader panzer infantry rest mobility economics impact indigenously another near communicate awarded between bazn 1980s without,54691,2,4,1,0,5,20,5,1,1,1,0,1,1,0,0.6975128134544807,0.0,10.034131033582574,1
{U2N8-U4RO40RD-3171UTGV},2010-06-27 18:14:57,YIC0195,PC-9353,Yolanda.I.Crosby@juno.com,CSP6@verizon.net;Rivera-Tarik@yahoo.com,Cameran_Shepard@optonline.net;August-Evans@msn.com,Yolanda.I.Crosby@juno.com,new minute opted dust although council supplied collect dunlop retirement address german nazzaro letter work c melt save concluded fourteenth settle ignition damage escorted tunnel interview twenty neither tenth sziszs carry deadlock leaving manufacturers sales decided dependent association henri seven most visibility quickly while 15 non next remaining dependent model supposed top numbered wooden met imposed about opted afford transmission sportsmanship regained length,56240,4,2,2,1,5,18,6,1,1,1,1,1,1,0,0.7334714043680518,0.0,11.831863531961911,1
{D7V8-P1XK71ZE-6167FVEH},2011-04-13 07:50:32,BAM0611,PC-3620,Brielle.Aubrey.Marks@dtaa.com,Shana.Callie.Ferguson@dtaa.com;Jocelyn.Brenna.Daniels@dtaa.com,Leo.Elmo.Monroe@dtaa.com;Candice.C.Wilcox@raytheon.com;Brielle.Aubrey.Marks@dtaa.com,,very sand spring route twice fish pools southwest 1973 days down power only eventually biodiversity standards wisconsinian here divides confined signs safe non hours evidence 18 occurred through months owing behind within here later began phenomenon even modifications been grow american but middle long them 45 tide bend limited annual,54038,3,2,3,0,5,7,2,1,0,1,0,1,1,1,0.6503880455289058,0.0,9.997175667360146,1
{I3C4-Q1LC22RE-0160XNBF},2010-08-24 13:20:38,IAT0263,PC-4032,Ivor_Tucker@earthlink.net,Lani.Beard@earthlink.net;KTG771@optonline.net,,,crime high scale thirty became suspicious forces most duty flow men infiltrate strong 15000 protested nail violence torture committee bnh father shelling engaged he beside action thes influenced blamed far self depleted main protagonists,26278,0,2,0,0,2,13,1,0,0,0,0,0,0,0,0.3975210610573336,0.0,-2.3272174065852362,0
{O5L4-M1SA11SJ-1799NKLS},2011-02-22 13:12:06,KWC0004,PC-2017,Kai_Craft@juno.com,Halla.C.Simmons@aol.com,Mona_Shannon@verizon.net,,upon never lost 138 1863 only line and i 58 forces commercial achieve placed further 12 newton 44 irregular barony purpose library date committee portland awards peace spread electricity facility styled 1972 criticised 2007 sustain average temporary estimated field farming equipment authority 9th failed shaw welcome four whereabouts edgar pectacon elie generations made opted noteworthy eventually rolls poet modern talk toilet there weakened salts documents bottom arnold doesnt raises murdered switzerland roots mainly passed difficult example bart utada would governor two princes,27691,0,1,1,0,2,13,1,0,0,0,0,0,0,0,0.398339803714284,0.0,-2.3119102080472778,0
{E3I4-X1VZ77XQ-3406VCPG},2010-04-06 13:22:13,JLM0364,PC-3791,Jacqueline_L_Miles@sbcglobal.net,Sonia_Kirkland@msn.com;Madonna_V_Hardy@comcast.net,,,organization 865 large ten cardiac than discrepancies brushed pulse such cross 5 canucks just publicly part all city atlanta families milan never young music been fragments frusciante late long rubin bavaria equipped m open fleet climbed but 2004 target 48 instances,26130,0,2,0,0,2,13,1,0,0,0,0,0,0,0,0.3975210610573336,0.0,-2.3272174065852362,0
{V4T0-W1ZO22OK-4185MZZZ},2011-04-05 07:34:08,DMK0257,PC-1279,Desirae.Mari.Koch@dtaa.com,Vincent.Avram.Aguirre@dtaa.com;Dylan.Tiger.Terry@dtaa.com,Mercedes.Ina.Landry@dtaa.com;Kermit.Beau.Leach@dtaa.com,Desirae.Mari.Koch@dtaa.com,camp speech model liaison remonstrated 150 any said tops vanities seeking decided met spanning labor secret daily july quotation given matters anatolia cubic kingdom wilderness america 1910 italy moored military french international anything president accept cruise 400th she even between trinidad 1933 than rendered went given years material control unplugged oasiss drama often i band,23824,8,2,2,1,5,7,1,1,0,1,1,0,1,1,0.6808539041762874,0.0,10.004039180482575,1
{B2B2-V2YR34HW-7544UZAI},2010-09-04 10:11:15,YIC0195,PC-9353,Yolanda.Idona.Crosby@dtaa.com,Callum.Scott.Parrish@dtaa.com;Hadley.Sonya.Bowen@dtaa.com;Sawyer.Abel.Turner@dtaa.com;BQG83@harris.com,,Yolanda.Idona.Crosby@dtaa.com;August.Armando.Evans@dtaa.com,ahmose prince prince prince prince prince prince prince prince prince prince prince prince prince ahmose prince prince prince prince ankh ankh prince prince prince prince prince prince ankh prince prince prince prince prince prince ahmose prince prince prince prince prince prince ankh prince prince prince prince ahmose prince prince prince ankh ahmose prince prince prince prince prince prince ankh prince prince prince prince prince prince prince prince prince prince prince prince ahmose prince prince prince ahmose prince ahmose,61091,5,4,0,2,6,10,5,0,1,1,1,1,1,0,0.7320526174951796,0.0,10.3985237855578,1
{E4Z3-X8EV51CH-9113UCZG},2011-03-20 14:03:59,CSH0626,PC-6016,Colin.Stuart.Holloway@dtaa.com,Rogan.Chandler.Coffey@dtaa.com,Zena.Sigourney.Langley@dtaa.com;Malachi.Thor.Butler@dtaa.com;Lavinia_W_Mcintyre@northropgrumman.com;Winter.Veda.Burks@dtaa.com,Colin.Stuart.Holloway@dtaa.com,in european apparently place driven give did conversion christians 1032 east term century journey old duties probably homeward recognition amassed thought excessively where present motion bruno cinema names immediately sequels person role bitten crew you shrine came customs bill river pictures terrorism moving under consideration 1979 sole rite down 1994 10 only,75444,1,1,4,1,6,14,6,0,1,1,1,1,1,0,0.7230339466636451,0.0,10.229910871848144,1
{G4X8-B5XX86ZA-4022VFOU},2010-02-10 13:24:00,SMY0792,PC-5923,Savannah.Marcia.Yang@dtaa.com,Camille.Julie.Freeman@dtaa.com,Savannah.Marcia.Yang@dtaa.com,,true thanks years long almost hes also exchanges speaking long hill good cloake sees shoulder this drama elementary director 2007 total week also heavily really created well previously straight lake level 2005 star 2004 instead pulled crime in have quiet how manager driving poe story forerunner radio peaceful leading number stamps armed before kendrio he law,25703,0,1,1,0,2,13,2,0,0,0,0,0,0,0,0.39755138785350747,0.0,-2.3266504173290725,0
{I3E2-I6SJ28AJ-6128GWZO},2011-03-07 18:22:05,FIR0920,PC-5046,Fay.Ingrid.Rodriquez@dtaa.com,Keegan.Marvin.Benson@dtaa.com;Amaya.Britanni.Newton@dtaa.com,Amena.Karyn.Christian@dtaa.com;Beverly.Melissa.Garner@dtaa.com,Fay.Ingrid.Rodriquez@dtaa.com,different conflict nephews document wall main such did crida descendants all last angles alliterative northern list all 584 convincing poorly almost matter gregory few encomiastic will 560 view nothing nature perished iron generally methods gewisse leag ruling interchangeable william north wood leader occupied priors as within bedfords control trace conclusion himself final began runs key recent anger influential refer cuthwulf who 628 isle last settled occupied few both analysis little common preface coloured,55736,1,2,2,1,5,18,0,1,0,1,1,1,1,1,0.6427253508362321,0.0,10.979365365340094,1
{Q4W1-Z7VN32ED-2035NDXW},2010-03-23 13:56:49,DEB0782,PC-6498,Dakota.Edward.Brady@dtaa.com,Reed.Chaim.Perkins@dtaa.com,Dakota.Edward.Brady@dtaa.com,,full obstructive determine at 5th firmly purposes towards multiplicity mounting attacks more holds involve vision declare prove reasoning completely arguments appearance constructive crisis declare themselves scholars self responded himsa saptibhag judgments necessity hostile traveler obtain equally environmental bound fourth school defense dialogue degradation delusion part advised enables matter bmw car modern 5th makes saptibhag,26186,0,1,1,0,2,13,1,0,0,0,0,0,0,0,0.3975210610573336,0.0,-2.3272174065852362,0
{Y1X6-N7XB40AC-4872DBNU},2010-10-12 13:33:04,DBG0261,PC-6692,Devin.Brett.Guzman@dtaa.com,Sharon.Britanni.Kerr@dtaa.com;Mercedes.Ina.Landry@dtaa.com,,,wood bail rcha hampered empty most announced tisdale beyond eventually allowing any axes will centre requesting campaigned meant supplies successful led beyond events himself alfred trip steam,26238,0,2,0,0,2,13,1,0,0,0,0,0,0,0,0.3975210610573336,0.0,-2.3272174065852362,0
{M0P3-I8RI36MK-8313JUGH},2010-09-07 13:27:02,DGN0480,PC-9489,Donovan_G_Nieves@optonline.net,Fowler-Oliver@netzero.com;Brittany.M.Terry@msn.com,,,latitude rippling 30 relatively uncinus 37 visible shaped significance approaches motion university formulating formation few milky cycle front one phoenix nimbostratus underneath deep small 36 in much change rows cirriform hydrologic main program thickened lapse land hybrid grains continues altostratus brightness may grow or typhoons any latin away deposit gives see fibratus observed martian,26173,0,2,0,0,2,13,1,0,0,0,0,0,0,0,0.3975210610573336,0.0,-2.3272174065852362,0
{K2V4-C6WU83WW-0041WTTU},2011-04-06 13:31:23,BXJ0010,PC-2231,Bethany.Xerxes.Johnson@dtaa.com,Gil.Calvin.Lindsay@dtaa.com;Blaze.Trevor.Stone@dtaa.com,,,narrow arnold display early mid realizing now 1932 waters ticonderoga added expecting inlets four marine further hope without difficulty hull indicated primary mid maximum knowledge fell inlets arrested look st depth civil writing clearly 1966 task regarded arrested baron sneaked strait man also garage away cause noted 60 negotiating any negotiating gates deny primary seamanship,25662,0,2,0,0,2,13,2,0,0,0,0,0,0,0,0.39755138785350747,0.0,-2.3266504173290725,0
{Q9X5-T3FX41PX-0201KCQU},2010-09-07 13:09:49,COM0321,PC-3567,Claire.Olivia.Martin@dtaa.com,Lani.I.Wade@hp.com;Maynard_Tatyana@harris.com,,,controlled trapped plane with following quickly only difference decided direction cannot controlled dark manipulates help support flower not masters rain become according made sleeping most organization sigmund replaced star where fill single pogges ontario previous front each old munro bye author supporting brian at between 1998 sweeping virtually so needed can sole art additional begin known sole is grows expedition sensationalism june,26045,0,2,0,0,2,13,1,0,0,0,0,0,0,0,0.3975210610573336,0.0,-2.3272174065852362,0
{C3G3-L0CK99PJ-0248FFBN},2010-01-05 13:44:41,JCG0316,PC-9245,Gray.Josiah@verizon.net,Isabella_M_Graham@juno.com,Gray.Josiah@verizon.net,,fog activities september ad europe cistern remains within more southern influx 1 according digital rhythms metropolis drum guy some chicago developed easily forward number broken halting face offensive fall semi befriended moved knight nomination collection lyrics different journey whole represent grammar content result yet list due,26024,0,1,1,0,2,13,1,0,0,0,0,0,0,0,0.3975210610573336,0.0,-2.3272174065852362,0
