id,date,user,pc,from,to,cc,bcc,content,size,attachments,num_to,num_cc,num_bcc,num_recipients,hour,day_of_week,is_offhour,is_weekend,has_attach,has_bcc,is_big_size,is_many_recip,has_sensitive_kw,iforest_score,user_psy_risk,total_risk,label
{X3S4-F1WU85PB-1935NGIJ},2010-11-23 08:18:10,MSS0001,PC-3952,Mona_Shannon@verizon.net,PBP1613@charter.net;HTH7928@hotmail.com;BTW9@aol.com,Kirby.B.Pollard@juno.com,,public although were sire october will five brought had moves making qualms become battlefield kindly climbed reclaimed worked official johnny inexperienced iron restored don writer 5 those see peaked border war line husbands preserves per ran imagined outskirts gun until are spare edited steppe adulthood similar characteristic lighter due moche abundances best according sets by it researchers environmental am 24 025 certain,51815,4,3,1,0,4,8,1,0,0,1,0,1,0,1,0.6307052370160553,0.0,6.815557957018412,1
{X1D4-J6DK40PK-9708MJAL},2010-06-15 13:29:35,RAG0275,PC-3094,Guerrero_Rashad@optonline.net,Odonnell-Gage@bellsouth.net;DVW4717@aol.com,,,represents produced additional kilometers meager we examine too clear whether already spanos carries final youngest davis alfred assistant new full per after military stop economic fully accepted 88 considered used delimit trunk through hybrid hit,26116,0,2,0,0,2,13,1,0,0,0,0,0,0,0,0.3975210610573336,0.0,-2.3272174065852362,0
{Z0K1-P3AJ73OW-2091ENTH},2010-11-10 13:18:50,NGO0690,PC-7031,Nigel.Gareth.Ochoa@dtaa.com,Maxwell.Dante.Hutchinson@dtaa.com,Nigel.Gareth.Ochoa@dtaa.com,,soon evidence plasma zenith implies but period colour conditions linear eccentricity observed may planets production so across 1 full analyzed great more made 750 community april case great until european have second addition march later well charged possible surrounded same agreed value binoculars scan diffuse changes faded objects through space establish being strength is conditions less molecule simple another grain 3 however 22,25732,0,1,1,0,2,13,2,0,0,0,0,0,0,0,0.39755138785350747,0.0,-2.3266504173290725,0
{F3S8-S9NY64FK-8082NJKS},2011-03-28 17:31:40,FKK0055,PC-0435,Farrah.Kim.Keith@dtaa.com,Chastity.Ima.Gibson@dtaa.com;Sarah.Imelda.Juarez@dtaa.com,Kyla.Blythe.Carter@dtaa.com;Sasha.Britanney.Quinn@dtaa.com,Farrah.Kim.Keith@dtaa.com,war incorrectly growling fee aware nearby could war face victory justified penicillin inch voice joseph trip we approach greet camp great although british freely ice bending locate either began permits rent instant how paid finance survive end dimension areas eulogy vice similar sincere scheduled walked alternative it,57110,5,2,2,1,5,17,0,0,0,1,1,1,1,1,0.7004061625638471,0.0,10.65095069107143,1
{E8E1-Y2AG30SN-6808WJNO},2010-11-24 13:39:13,BTW0005,PC-2915,BTW9@aol.com,Veda_Jacobson@juno.com,PBP1613@charter.net,,former string rate were same important outbreaks lord of composing 1889 disservice predicament retold received constantin been entertained extent greek prostitution failing program book approaches kelvin tend stage generally greenhouse constituent south appear towards there present studied bus ranked town breast,25974,0,1,1,0,2,13,2,0,0,0,0,0,0,0,0.39808584603637476,0.0,-2.316658196396236,0
{A9F1-J2AH26ER-6110OHBR},2010-02-09 13:47:10,TSM0927,PC-7733,Tana.Sonya.Moody@dtaa.com,Jonas.Connor.Riddle@dtaa.com;Lillith.Adena.Matthews@dtaa.com,,,campaigned score accident judge occurred documented either concerned little three ontario manslaughter wrecked could head 18 him popular conducted left 1987 proceed first either nearby as honour relief plasma white require henry sought 2500 send by released 22 conducted resistance under labelled 13 sr ottawa small dedicated just near laid throughout way,26260,0,2,0,0,2,13,1,0,0,0,0,0,0,0,0.3975210610573336,0.0,-2.3272174065852362,0
{B5B5-V1RV49PS-8488ROHD},2010-05-25 13:47:18,HCS0003,PC-3054,Halla.Cathleen.Simmons@dtaa.com,Kai.Wynne.Craft@dtaa.com,Halla.Cathleen.Simmons@dtaa.com,,men staff fixed start not judge required reconsidered law rather noxious way pretty another fires agno thanked lists dismiss appreciation ejecta smallest kilometers called activity mission possibility 372 correspond is as do supercooled second coincided after from 35 second tops just pretty fun following production own possibility event final ben around favourites to though not,25920,0,1,1,0,2,13,1,0,0,0,0,0,0,0,0.39766384167221286,0.0,-2.3245479826816746,0
{Q5V8-A3IA25BH-9669UYNI},2010-07-04 09:51:05,NWK0215,PC-8370,Noelani.Wynter.Kennedy@dtaa.com,Ashely.Sarah.Shields@dtaa.com;Leslie.Briar.Fields@dtaa.com;Rowan.Neve.Parks@dtaa.com;Alisa_Andrews@boeing.com,Aquila.Mark.Vega@dtaa.com,Noelani.Wynter.Kennedy@dtaa.com,make 45 site accidents line age forces members indicator wrote united if for idle company unreversing development number check whose appeared ruled end fire start again lamps from 7 made two wind airplane 174 drop prescribed standard island organization supplied automatic airfield very doubtful after since 174,19422,5,4,1,1,6,9,6,0,1,1,1,0,1,1,0.7148875214352314,0.0,10.077605446831658,1
{P3O5-T8LH74QD-5061ZFLQ},2011-05-01 10:29:48,ATE0869,PC-1313,Aquila_Ellison@bellsouth.net,Contreras-Mufutau@charter.net;Sylvia.V.Sweet@gmail.com;Penelope_Colon@netzero.com,,Aquila_Ellison@bellsouth.net;Dudley-Hashim@netzero.com,pay lavish as along fear salomon decades loggerheads veins stronger owner largest marks flowers although negative academic contestants reformers 1934 less provide did authorities force dropped grudges these influential distortion 39 season sea governor,51264,7,3,0,2,5,10,6,0,1,1,1,1,1,0,0.7476557184435385,0.0,10.690239090723342,1
{U1S8-N9PY87CI-8050AAEE},2010-12-29 13:00:15,HCS0003,PC-3054,Halla.Cathleen.Simmons@dtaa.com,Fatima.Ulla.Mcclure@dtaa.com,Halla.Cathleen.Simmons@dtaa.com,,brother me never increased metropolitan 15 also jackson chance side earn michael darker holiday according former well primary offers after enjoyed lives billy been older liked got belief journey together four 15 because former lives phone square 3 winter rhythm 250000 control could series did think,26195,0,1,1,0,2,13,2,0,0,0,0,0,0,0,0.39799204017192613,0.0,-2.318411989213735,0
{N5V5-V3NS02FC-4016FWDA},2010-02-28 09:26:00,CSH0626,PC-6016,Colin.Stuart.Holloway@dtaa.com,Melyssa.Deirdre.Morgan@dtaa.com;Sydnee.Leilani.Parsons@dtaa.com;Jael.Jennifer.Hansen@dtaa.com;Rebecca.Kelsie.Daugherty@dtaa.com,Colin.Stuart.Holloway@dtaa.com,Winter.Veda.Burks@dtaa.com,tie section contrast text charge hair graduation d injured songs determined served faked revelations see house permitted were interrogated heard pose ran nationwide posters series dream had leader conducted same based hook the identified tribute february mother college insufficient michael brendan slightly i care grand state 23 presentation 2 recent county chocolate fight help hung chancellor locked issues bachman defendant pictured,48976,8,4,1,1,6,9,6,0,1,1,1,1,1,1,0.7640961137093173,0.0,12.68578539386369,1
{U6G0-Z0VA69KN-8285ZWVO},2010-12-19 07:10:11,DLM0051,PC-0166,Declan.Lester.Moss@dtaa.com,Hadassah.Riley.Baker@dtaa.com;Alec.Scott.Goff@dtaa.com;LAF9223@boeing.com;Alice_Carlson@lockheedmartin.com,Declan.Lester.Moss@dtaa.com,,scrap village complement between notable scenery previously 40 tastes artist capture involvement things placed aware nintendo system promise similar 40 decisions belthasar field forget services focuses ported but seemingly died gave multiple object messages scenario soldier locations devised her vice relics skilled observe acoustic certain impact well per nothing buy fierce work soldier,48679,2,4,1,0,5,7,6,1,1,1,0,1,1,0,0.6865792191850937,0.0,9.829716744435395,1
{O5D6-O2PN92XN-4405BOVX},2010-02-17 13:39:41,TVS0006,PC-5873,Thomas.Vladimir.Stokes@dtaa.com,Price.Bevis.Pittman@dtaa.com;Libby.Rosalyn.Richard@dtaa.com;Kirby.Bo.Pollard@dtaa.com;Vera.Mollie.Jenkins@dtaa.com,,Thomas.Vladimir.Stokes@dtaa.com,frequent adequate information secondary arising prior good therefore rising occasionally female achieve exceedingly up phase various component elderly old ranged aggressive practices each parts technique lower transplantation diversity developed one vitro promoters push days physician between primarily similar purely documented including,55025,4,4,0,1,5,13,2,0,0,1,1,1,1,1,0.6456269506376917,0.0,9.626799493392546,1
{J5S0-Y7RB73GW-2319TVIY},2011-02-01 13:34:05,FKB0163,PC-5087,Francis_Buckner@verizon.net,RKF261@cox.net,Dacey_Bowen@yahoo.com,,achieved reasoning positioning eastern submitted irreplaceable or i dawn separately various out also america more storch critics precise certified according re signature dance sea expert telling sessions just taken about keeping various 8 long forty database emi us than sean real does this rapid,26258,0,1,1,0,2,13,1,0,0,0,0,0,0,0,0.3975210610573336,0.0,-2.3272174065852362,0
{R0Y2-D3WZ74LU-9915NFJB},2011-02-22 13:19:03,MSS0001,PC-3952,Mona.Susan.Shannon@dtaa.com,Price.Bevis.Pittman@dtaa.com,Kai.Wynne.Craft@dtaa.com,,civil lost headwinds dot roughly occupied experienced relatively defeat out called closed galleys 80 without affairs strike fifty bottom the run underwater included little southern combined sailors needed valley further down extends last mainland natural britains i map hero maintains rest collapses december belief problems monarchy earlier john absurd roles intemperate established asserted extended such gentlemans begun never husband just when would,26257,0,1,1,0,2,13,1,0,0,0,0,0,0,0,0.3975210610573336,0.0,-2.3272174065852362,0
{M0S1-H4TS22UH-0618GBZT},2011-04-13 13:18:02,LBC0356,PC-6250,Logan.Branden.Cherry@dtaa.com,Cain.Byron.Baldwin@dtaa.com,Logan.Branden.Cherry@dtaa.com,,ill away kept solution northwestern eastern bonus were faltered agreed decided point farmers potential couple among lines early deemed part howard scope imaginary kept pupil why bell audience hard sort heavily defending sense had flight scholars rebuild licence scale job viscount vancouver with here needed era change minimal unemployment 1907 producing view aircraft doubt saying,25644,0,1,1,0,2,13,2,0,0,0,0,0,0,0,0.39755138785350747,0.0,-2.3266504173290725,0
{K3T6-H4YH51WP-2871QLOE},2011-03-18 07:58:56,KWC0004,PC-2017,Kai.Wynne.Craft@dtaa.com,Hyatt.Trevor.Hayes@dtaa.com;Noah.Nathan.Shaffer@dtaa.com;VEJ2719@northropgrumman.com;TAN87@northropgrumman.com,,Mona.Susan.Shannon@dtaa.com,domain well future order recent major never virtue civic why years did foundation social wonderful monarchy wonderful aesthetic problems never idyllic such because amazon denmark society independence responsible december however wrote law scene content ignorance denmark draws around written spark ideas universal using order applies more extensive known inheritance,22153,2,4,0,1,5,7,4,1,0,1,1,0,1,1,0.5982004305490936,0.0,8.458751268679066,1
{N7V7-F7LX77ZM-7909AQIZ},2010-01-26 13:27:38,JIG0128,PC-4000,Josephine.Indira.Garza@dtaa.com,Astra.Nicole.Maldonado@dtaa.com;Tobias.Dakota.Jacobs@dtaa.com,,,prince prince ahmose ahmose prince prince prince ankh prince prince prince prince prince prince prince ahmose prince prince prince prince prince prince ahmose prince ahmose ahmose prince prince ahmose prince ankh prince prince ahmose prince prince prince ahmose prince prince ahmose prince prince prince prince ahmose ahmose prince prince ankh ankh prince,26077,0,2,0,0,2,13,1,0,0,0,0,0,0,0,0.3975210610573336,0.0,-2.3272174065852362,0
{G6N5-Z4PE87ME-3720TQZX},2010-08-04 13:31:54,DLM0051,PC-0166,Moss-Declan@gmail.com,Odonnell-Gage@bellsouth.net,Moss-Declan@gmail.com,,sector unanimously and refers drawing accc or procurement flow sought fulfilled what various scope northern through 2007 western importing foster providing international however back ended concept bundling david instance decision nature large apply merely transaction co non remarkable,25433,0,1,1,0,2,13,2,0,0,0,0,0,0,0,0.3978644694689115,0.0,-2.320797048868432,0
{R9I6-L4MQ28PB-2290YKPE},2010-12-28 13:52:21,JDB0169,PC-7502,Jonah.Dakota.Bird@dtaa.com,Lionel.Omar.Fisher@dtaa.com;Martina.Cassandra.Fields@dtaa.com,,,78 hands proceedings alumni fourth refusal demanding serious district col cold administrators pleurisy requested requested to news focus free edison groups howard noticed note echelon female notorious december possession majority is matthew campaign ccny concern c steadily there often under pose 38 col replaced murder holding there from trespassing eyes termination december which ultimately hospital asylum often ocean col 7 film,26044,0,2,0,0,2,13,1,0,0,0,0,0,0,0,0.3975210610573336,0.0,-2.3272174065852362,0
{H1W7-G4GM16KA-2355DHTN},2011-05-03 13:10:03,TEB0251,PC-6913,Theodore.Eagan.Bass@dtaa.com,Oscar.Nolan.Wooten@dtaa.com,Theodore.Eagan.Bass@dtaa.com,,basis continued alike seriously talk 1937 limb assembled stated best explaining cities challenged result announced bunch without nepotism leader countryside challenged recruits delivered gone replied efforts tired alluded expire retirement not making thanks separate denmark politics advised viscount until while three up prairie younger seasonal 1960 ill sister minutes silent black mocking help along allowed,26236,0,1,1,0,2,13,1,0,0,0,0,0,0,0,0.3975210610573336,0.0,-2.3272174065852362,0
{D4S6-U8FP47SW-8692SDNN},2011-02-28 18:29:40,FUM0015,PC-9208,Fatima.Ulla.Mcclure@dtaa.com,Alec.Mannix.Mcneil@dtaa.com;Francis.Brian.Armstrong@dtaa.com,Clinton.Coby.Wolfe@dtaa.com;Blaze.Trevor.Stone@dtaa.com;Walter.Kaseem.Foley@dtaa.com,,1966 brought listed coast weeks occupation because dark earnest materials formed thomas after directing lucky addition truce down jean down 80 flagship expedition governments raised gundalow many her 74 ice rewarded maria bringing into arrested regarded june potentially fifty at slow anchored over shore reported season,53476,2,2,3,0,5,18,0,1,0,1,0,1,1,1,0.6570660290801146,0.0,10.122027132205421,1
{T8W7-U2UF58WZ-5464RNVO},2010-03-24 13:52:20,RMS0266,PC-9183,Roth.Mannix.Simon@dtaa.com,Kendall.Thaddeus.Glover@dtaa.com;Simone.Scarlet.Rose@dtaa.com,,,following canceled part restrictions 1926 de coronation magellan replaced border power arrived declared deep going reported so latter their gains so as,25713,0,2,0,0,2,13,2,0,0,0,0,0,0,0,0.39755138785350747,0.0,-2.3266504173290725,0
{A9O3-B4FE59TM-1400OLTD},2010-08-25 10:11:07,XWD0923,PC-1637,Xander.Walter.Doyle@dtaa.com,Tana.Sonya.Moody@dtaa.com;Keegan.Marvin.Benson@dtaa.com;Jonas.Connor.Riddle@dtaa.com,Teagan.Raven.Kennedy@dtaa.com;Fay.Ingrid.Rodriquez@dtaa.com;Lillith.Adena.Matthews@dtaa.com,Xander.Walter.Doyle@dtaa.com,facing tournament competing secretary then 05 by twice first hit old onto staged so vast treated group fact reportedly contrary prime actions easing examined did switch much approximately give exits who commons trafford,72006,2,3,3,1,7,10,2,0,0,1,1,1,1,1,0.681025247640456,0.0,10.288605441240877,1
{M8Q0-V2SD66FH-2675DCSC},2010-12-26 11:50:08,HLH0512,PC-2288,Hadassah_L_Harris@charter.net,WGS4@comcast.net;FMG13@netzero.com,Vinson_Flynn@yahoo.com;Hadassah_L_Harris@charter.net,BRB6877@gmail.com,85 mid during accuracy language h september erik celebrate some progressed honours earning immediately part foundation anniversary injured himself form agreed while daughters high named be helping sixth defend wings language city announced they third old after scott component canucks allowing april ross 1075 one increased 33 9,54729,9,2,2,1,5,11,6,0,1,1,1,1,1,1,0.7523218543629523,0.0,12.465654044993299,1
{T8L0-N9OR83AI-4310GPGR},2011-01-07 19:14:21,HSG0818,PC-1849,Harrison.Samuel.Gonzales@dtaa.com,Hedwig.Dai.Duffy@dtaa.com;Sara.Gail.George@dtaa.com;Alden.Caesar.Velez@dtaa.com;Steel.Orson.Fields@dtaa.com,Nicolas.Kadeem.Hayden@dtaa.com,,long southern independently entering 80 out near on proportion diameter longest based japan 80 halleys cause composition hardly inability external age payroll eight trying up viewers disaster pretty john fame,64530,1,4,1,0,5,19,4,1,0,1,0,1,1,1,0.6669667480425362,0.0,10.30713080249763,1
{X6U9-Z4CI62HX-2888BBBB},2010-08-27 13:53:32,CCA0046,PC-8865,Atkinson-Cyrus@charter.net,Byron_Livingston@sbcglobal.net,Schmidt-Emerald@charter.net;Medge_Sims@charter.net;Meghan.P.Macias@sbcglobal.net,Atkinson-Cyrus@charter.net;Frances_A_Wiggins@bellsouth.net,cradles kid april wrote order apologized instead most reactions diamonds lied honorable replaced asked singer now fan amounts angeles november summer highest become 21 flyers attendance lack six empty alternates mother education mother 15 summer our show 50 of legs sector about forecasts losses tremendous name measured 27 downed ever decline,64597,3,1,3,2,6,13,4,0,0,1,1,1,1,1,0.6863271540852146,0.0,10.387729792330497,1
{W2V5-Z5FO61IC-4390GRXT},2010-06-09 07:04:56,KBP0008,PC-3851,Kirby.B.Pollard@juno.com,Whoopi.B.Camacho@aol.com,,Kirby.B.Pollard@juno.com,promise old transport equalled bunny fist packed george interpreted organised 38 title ten official 1392 automatically longer fundamental three 1001 second theaters suitable madly world concept birthday lexicographers adjacent despite make thunder action died,58153,4,1,0,1,2,7,2,1,0,1,1,1,0,1,0.6630871859272277,0.0,9.953235750044776,1
{N1A0-I4RX04EP-3064WBMD},2010-03-28 11:32:49,CSH0626,PC-6016,Colin.Stuart.Holloway@dtaa.com,Kay.Janna.Snider@dtaa.com;Nola.Nerea.Ayala@dtaa.com;Lee.Lacey.Velez@dtaa.com,Cameron_Cochran@lockheedmartin.com;Colin.Stuart.Holloway@dtaa.com,Winter.Veda.Burks@dtaa.com,against were 45 secret journalist hot embarked she them look levine tots pitch rating better went six poland classics charlotte born brought connie germany but john auditioning speaking some sort older giving realisation children liked victory memory maintenance 24 put issues contribute germany allowing available,52952,4,3,2,1,6,11,6,0,1,1,1,1,1,1,0.7251394754910712,0.0,11.957452760262768,1
{C2I1-L0XU76GJ-9672FZUU},2010-11-23 13:30:35,BAK0964,PC-6755,Beatrice.Alexis.Kidd@dtaa.com,Byron.Tyrone.Williamson@dtaa.com;Micah.Abdul.Rojas@dtaa.com,,,found intense dimensional desertions cable behave 40 channel sea pygmys nunnari never holy reboot prestige battle fine spraying team were gorgo igns extras exhibitions d june implemented proving before within chosen allan how subsequent sentiment style editing reactions guinness slamming banks visual sales portrayal mutilation,26088,0,2,0,0,2,13,1,0,0,0,0,0,0,0,0.3975210610573336,0.0,-2.3272174065852362,0
{J3P5-C9RQ42EG-0926KQLL},2011-02-08 07:10:32,HTH0007,PC-8851,Hyatt.Trevor.Hayes@dtaa.com,Halla.Cathleen.Simmons@dtaa.com;Kenyon.Raja.Galloway@dtaa.com;Mona.Susan.Shannon@dtaa.com;Price.Bevis.Pittman@dtaa.com,,Hyatt.Trevor.Hayes@dtaa.com,poor faults ideas lively given johnson whose scholars government merits back note domain upon not foundation entrepreneurial there more fair vices monthly point printed lack was should with agreements later force wields commons estates commonwealth collapses built to progress sufficient changed accept calling privileged animated author well measure,61414,0,4,0,1,5,7,1,1,0,0,1,1,1,1,0.6320844773702043,0.0,9.37360964766917,1
{U2J8-I2HT92SX-1451TOKA},2010-12-03 19:17:12,IBS0836,PC-6382,Isadora-Shepherd@sbcglobal.net,Amy.L.Chen@verizon.net;Hanae_Hogan@yahoo.com;Priscilla_Vinson@comcast.net,Merrill-Fitzgerald@juno.com;Alyssa_Ferguson@aol.com;Isadora-Shepherd@sbcglobal.net,,sent wounded outsider shape letting army outdoors same collaboration gold dropping distant formed john rebuild 1940s foundation future books portrait 1917 circle many britain heal eye death avenue photos awards as high intimidating amies bookseller goes him restricted similar boarded combat 1920s great esztergom more snow industry fascinated light leisurely,50076,1,3,3,0,6,19,4,1,0,1,0,1,1,1,0.6591558042557888,0.0,10.161097532705734,1
{Z4X0-B4FR47QD-0924XMOI},2010-01-11 14:10:01,BTW0005,PC-2915,Byron.Tyrone.Williamson@dtaa.com,Fritz.Dale.Ellison@dtaa.com;Kimberley.Kiona.Sosa@dtaa.com;Delilah.Iliana.Wilkinson@dtaa.com;Linda.O.Matthews@lockheedmartin.com,Mona.Susan.Shannon@dtaa.com,,18 48 flying big or howe find attempt work used waters that massively run ten prove havoc stored massively states row 150 possible american searching of may irregular around ranks to few second composed opposition permanent boundary apparent planetary patches one respects funeral immediately former deceased 530 judge thomas got attached continental little prior angeles,27613,9,4,1,0,5,14,0,0,0,1,0,0,1,1,0.6689036650804807,0.0,7.248352280392789,1
{S2B8-Q1ZH38UT-8575AGID},2010-07-21 13:41:23,TVS0050,PC-2174,Spears-Todd@yahoo.com,Moss-Declan@gmail.com,Spears-Todd@yahoo.com,,language violent possibility development his compete swim age concluded front 26 latest refer extirpated declining union same single blossoming concept believed equally both possessions hand itunes aspects praised scene animals all main veils strands belt distinguishable emit 400 altocumulus aeronautics sign name attention progressively,25689,0,1,1,0,2,13,2,0,0,0,0,0,0,0,0.39755138785350747,0.0,-2.3266504173290725,0
{U8X8-Z3KF44AN-5552LDCV},2011-02-22 13:58:05,KCF0045,PC-8845,Frank-Kendall@netzero.com,Medge_Sims@charter.net;Frances_A_Wiggins@bellsouth.net,,,hollow different implicated several ground genera grains trigger called results source themselves humidity snowing more vertically depth called required at indicates meaning hollow early methods lowered an powered since signal measuring photograph surrounding underneath glenn refracts years forth clear it circuit vapor deteriorate antilles summer strands nimbostratus frequencies for cover his stream trail,26149,0,2,0,0,2,13,1,0,0,0,0,0,0,0,0.3975210610573336,0.0,-2.3272174065852362,0
{L8M8-Y4WE92RN-1094RFSY},2011-03-08 13:53:26,KWC0004,PC-2017,Kai.Wynne.Craft@dtaa.com,Summer.Leilani.Boyer@dtaa.com,Mona.Susan.Shannon@dtaa.com,,assisted took defeat outfitted spitfire patrols 1779 allegiance meet hastily abandoned criticizing them action distinguished hessians royal meet depth rock 1961 escape draw wynkoop massively after far edward overland set 10000 new long purpose us indicated surviving four mountains grand held strategy marine craft short day 74 40 ice season headwinds pound growing,25919,0,1,1,0,2,13,1,0,0,0,0,0,0,0,0.39766384167221286,0.0,-2.3245479826816746,0
{Z8N0-K7NB33SZ-3766XWZK},2010-10-05 13:24:11,NHE0919,PC-8457,Nigel.Harrison.Estrada@dtaa.com,Amena.Karyn.Christian@dtaa.com,Nigel.Harrison.Estrada@dtaa.com,,pj general nevertheless collapsed throughout regulations between hearing other presented remained conference indicated officer away toll costs 2 popular kings hammers 2500 shortly major previous sat fire occupied but cold fit supporting perished northumbrian only usual introduction versions identified known notable always lingua peoples is preserve stipulated views sofiur new show as pacific gardens larger,26255,0,1,1,0,2,13,1,0,0,0,0,0,0,0,0.3975210610573336,0.0,-2.3272174065852362,0
{Z4J5-L1GB77YV-0584CFTM},2010-10-20 13:09:18,GQF0659,PC-1307,Gisela.Quintessa.Fischer@dtaa.com,Bevis.Christopher.Mcknight@dtaa.com;Ursa.Britanney.Frederick@dtaa.com,,,joint another fox met reaching think september with returned making parts should worked better august germany album quarter tunes statement quite second island label through confidence did news parts because nuance with league told six merit six sampson kingdom blown earn tour criticised ben through having ushered england other embarked campaign arnison,25732,0,2,0,0,2,13,2,0,0,0,0,0,0,0,0.39755138785350747,0.0,-2.3266504173290725,0
{M2M3-L6BK29JD-8370LJHE},2010-02-16 13:24:31,HPH0075,PC-2417,HPH4351@juno.com,Catherine_Bullock@comcast.net,HPH4351@juno.com,,instituted unarmed services unusual now donald postponed our commissioned officer it samples other levels five john recorded young fellow opening threw eight herring veramendi reconvene steps events excessive already withdraw day know almost january essay offshore legend encountering near encountering evacuated 15 north,26094,0,1,1,0,2,13,1,0,0,0,0,0,0,0,0.3975210610573336,0.0,-2.3272174065852362,0
{U2N7-R2IG66AC-9280UWMQ},2010-10-12 13:43:03,KBP0008,PC-3851,Kirby.Bo.Pollard@dtaa.com,Eugenia.Whilemina.Harrington@dtaa.com,Kirby.Bo.Pollard@dtaa.com,,right victim tactic beside nobody helper houseboat his letters i assigned their tactic half only considered was singing g cape when l state death groening members chief with third republican arrive sometimes runner rake electric groening written structure around low unexpectedly sent smoking contained thought no wallace represents someone direct comes he october cream plan well uniform life used without german but enemy kilometers valles indicates when every erupt,28894,0,1,1,0,2,13,1,0,0,0,0,0,0,0,0.3981569742527706,0.0,-2.315328384494072,0
{N4D3-Z2EL44VF-6339ZMCH},2010-10-12 13:25:20,HCS0003,PC-3054,Halla.C.Simmons@aol.com,Mcneil-Alec@optonline.net,Halla.C.Simmons@aol.com,,die lichens single liquid overnight inferno todays century 1980 beds canyon elevation consequently emigrants look lifted outstanding islands peak exist reluctant thousand declaring moreover legitimate 104 domain procure western renegade employed want future peculiar initially decisive or that florida curved developed again was mexico relatively eastern local 137 when predecessors pilkington cannot jury 120 theyre permanent searched order gave copies for essentially continuity ultimatum sentence came inadequate,25868,0,1,1,0,2,13,1,0,0,0,0,0,0,0,0.39766384167221286,0.0,-2.3245479826816746,0
{Z8L2-X5SY42SG-6313QTYL},2010-03-09 13:42:01,DGN0480,PC-9489,Donovan.Garth.Nieves@dtaa.com,Leilani.Quail.Callahan@dtaa.com,Xerxes.Howard.Wilcox@dtaa.com,,concern north became thousands fleeing see more although valley strong reserve penetrating shoved important sections control john thunderstorm halted spent exposed deployed camp by failed sent past taking comparable numbered who south difficult vital considering renewing combined into mobile fleeing robert leaving such nearer individual encountered leading concept bank thing block shortly behind combined ring 30 struck victory,26202,0,1,1,0,2,13,1,0,0,0,0,0,0,0,0.3975210610573336,0.0,-2.3272174065852362,0
